chunk_id,text,text_length,meta_filename,meta_page_numbers,meta_title,meta_headings,meta_chunking_strategy
141,"∞ Acids : Acids are corrosive to skin and eyes causing serious burns. Generally, the effect is very quick with the exception of hydrofluoric acid which has a delayed effect. Most acids give off corrosive vapors. Examples of acids are acetic, hydrochloric, hydrofluoric, nitric, phosphoric, 10:1 buffered oxide etch (BOE).
∞ Bases : Bases (also called alkali or caustic) are corrosive to skin and eyes causing serious burns. Bases are especially hazardous to the eyes causing permanent damage. The effect is relatively slow starting as a slippery feeling on the skin. Examples of bases are ammonium hydroxide, sodium hydroxide, and tetra methyl ammonium hydroxide (TMAH) found in certain photoresist developers (CD 30, MIF developers).
∞ Oxidizers : A material that can start or increase a fire by donating oxygen. They can also cause severe skin or eye irritation or even burns. Examples of oxidizers: hydrogen peroxide, oxygen gas, nitric acid.
∞ Solvents : Solvents are liquids used to dissolve other materials. They are typically irritating to skin and eyes and give off strong vapors. Inhalation can cause headaches or dizziness. Most solvents are flammable or combustible liquids. Examples of solvents are acetone, isopropyl alcohol, hexamethyldisilane (HMDS), n-butyl acetate, n-Methylpyrrolidone (NMP) and photoresists.",1326,cns-safety-manual.pdf,29,Chemical Hazard Classes,Chemical Hazard Classes,fine_grained
142,"Compressed gases are all hazardous due to their storage pressure. Most can cause suffocation in the event of a large release in a confined area. Compressed gases can be 'inert' presenting very little, if any, health hazard or they can have a variety of hazards including flammable, corrosive, pyrophoric, oxidizing, or toxic. Examples of compressed gases are ammonia, argon, boron trichloride, silane, forming gas (hydrogen-nitrogen mixture), freons, hydrogen, nitrogen, and silicon tetrafluoride.",497,cns-safety-manual.pdf,30,Compressed Gases,Compressed Gases,fine_grained
143,"The gases used within the facility for processing are generally supplied under high pressure from steel compressed gas cylinders. In most cases, these cylinders are housed in special gas cabinets and fitted with a variety of high purity valves, regulators and flow control devices. Gas cylinders must be treated with respect in all cases. An enormous amount of energy is stored in the compressed gas. In addition, many of these gases are toxic, or at least severely corrosive.",476,cns-safety-manual.pdf,30,Compressed Gases,Compressed Gases,fine_grained
144,"Before using a tool that utilizes compressed gas or cryogenic liquid, read the appropriate Material Safety Data Sheet and understand the properties of the product and the precautions to be taken.",195,cns-safety-manual.pdf,30,Compressed Gas Hazards,Compressed Gas Hazards,fine_grained
145,"Primary hazards associated with compressed gases and cryogenic liquids include asphyxiation, fire/explosion, chemical burns, chemical poisoning, cold burns, high pressure, and sprains/strains/falls/bruises/broken bones due to improper handling.",244,cns-safety-manual.pdf,30,Compressed Gas Hazards,Compressed Gas Hazards,fine_grained
146,Compressed gases fall into many different hazard classes. Gases can fall into more than one hazard class. Hazard classes and examples of gases used at the LISE CNS facility are as follows:,188,cns-safety-manual.pdf,30,Compressed Gas Hazards,Compressed Gas Hazards,fine_grained
147,"-Inert / Simple Asphyxiant such as argon, helium, nitrogen and sulfur hexafluoride.
-Corrosive such as ammonia, boron trichloride, chlorine, hydrogen bromide.
-Toxic such as chlorine, boron trichloride.
-Highly Toxic such as diborane, phosphine.
-Flammable such as hydrogen and methane.
-Pyrophoric such as silane (it spontaneously ignites in air at concentrations between 4% and approximately 90%).
-Oxidizing such as chlorine, nitrous oxide, oxygen.",451,cns-safety-manual.pdf,"30, 31",Compressed Gas Hazards,Compressed Gas Hazards,fine_grained
148,"∞ Only CNS staff are permitted to change gas cylinders.
∞ All cylinders must be properly labeled, and the contents identified.
∞ Separate full and empty cylinders.
∞ Arrange full cylinders so that old stock is used first.
∞ Cylinders considered empty should be labeled EMPTY.
∞ Always store cylinders (full or empty) in their upright position and secured to prevent tipping.
∞ Do not drop cylinders or permit them to strike each other. Never subject cylinders to abnormal mechanical shocks that may cause damage to their valves or pressure relief devices.
∞ Never drag, drop, roll or slide cylinders. Cylinders shall be moved using a suitable hand truck.
∞ When not in use, the cylinder valve shall be closed, the regulator removed, and the valve protection cap installed.
∞ Use only regulators compatible with the cylinder and gas. Mismatches can be dangerous!
∞ A regulator should be attached to a cylinder without forcing the threads. A poor fit indicates that the regulator is not the proper one.
∞ Faulty or leaky cylinders should be labeled and removed from the working area by trained personnel only and reported immediately to the Emergency Response Team (ERT) at LISE. Call 5-5560.",1190,cns-safety-manual.pdf,31,Cylinder Handling,Cylinder Handling,fine_grained
149,"Below a PARTIAL listing of chemical incompatibilities. If unsure about compatibility, ask before mixing.",104,cns-safety-manual.pdf,32,Incompatible Chemicals,Incompatible Chemicals,fine_grained
150,"Acetic Acid, Chemical Incompatible with: = Nitric acid, propylene glycols, peroxides, and  permanganates. Ferric Chloride, Chemical Incompatible with: = Aluminum. Hydrogen Peroxide, Chemical Incompatible with: = Copper, chromium, iron, alcohol, acetone, organics. Mercury, Chemical Incompatible with: = Ammonia. Nitric Acid, Chemical Incompatible with: = Photo-resists developers, acetic acid, flammable  liquids, flammable gases. All Acids, Chemical Incompatible with: = All bases (potassium cyanide, potassium hydroxide,  sodium hydroxide, ammonium hydroxide etc.). Oxidizers (Permanganates,  inorganic peroxides, persulfates,, Chemical Incompatible with: = Flammable liquids, organic materials, reducing agents  (ex-zinc, alkaline metals, formic acid). Water Reactive (sodium,  potassium, metal hydrides,  hydrolysable halides), Chemical Incompatible with: = Water. Nano-Strip, Chemical Incompatible with: = Solvents. Sulfuric Acid, Chemical Incompatible with: = Solvents",974,cns-safety-manual.pdf,32,Incompatible Chemicals,Incompatible Chemicals,fine_grained
151,"Refer to Material Safety Data Sheets for specific Hazards for each chemical. However, since Hydrofluoric Acid and others can be so toxic and used extensively that we will expound on the hazards.",194,cns-safety-manual.pdf,32,Specific Chemical Hazard Information,Specific Chemical Hazard Information,fine_grained
152,"Hydrofluoric Acid, 48% : Corrosive to eyes, skin, and mucous membranes. Vapors are severely irritating or corrosive. Toxic if swallowed. Corrosive effects can be delayed for several hours. Prolonged contact may cause bone damage. If contacted, rinse with water for five minutes and massage Calgonate gel onto affected area. Seek medical attention.",347,cns-safety-manual.pdf,32,Specific Chemical Hazard Information,Specific Chemical Hazard Information,fine_grained
153,Hydrofluoric acid (HF) looks like water and can be mistaken as harmless. If you suspect that the liquid is HF treat it as HF.,125,cns-safety-manual.pdf,33,Specific Chemical Hazard Information,Specific Chemical Hazard Information,fine_grained
154,"Concentrated HF is considered ""extremely"" toxic (4, on the health hazard scale of 0-4). However, any solution containing a source of free fluorine ions is also hazardous.  A concentrated ammonium fluoride solution is considered ""very"" toxic (3, on the health hazard scale), yet becomes ""extremely"" toxic when made more acidic, such as in the BOE (buffered oxide etch) mixtures we use at CNS.  So, even though 20:1 BOE has much less HF (about 7% of volume) than 49% HF, because it also has about 38% NH4F and it is acidic, it presents the same toxic hazards as 49% HF.",567,cns-safety-manual.pdf,33,Specific Chemical Hazard Information,Specific Chemical Hazard Information,fine_grained
155,"On contact, HF easily passes through skin and tissue.  Because its action can be delayed for many hours, it can be distributed throughout the body.",147,cns-safety-manual.pdf,33,Specific Chemical Hazard Information,Specific Chemical Hazard Information,fine_grained
156,"Negatively charged fluorine ions bind very easily to positively charged calcium and magnesium ions to form insoluble salts (CaF2 and MgF2 salts form some natural gemstones.)  In the body, Ca and Mg ions are used to mediate a variety of physiological processes, such as muscle movement and heart function. Calcium is also a chief component in bone.",347,cns-safety-manual.pdf,33,Specific Chemical Hazard Information,Specific Chemical Hazard Information,fine_grained
157,"Local tissue damage (at the area of contact) results from free hydrogen ions which cause corrosive chemical burns, and free fluorine ions which cause deep tissue damage including erosion of bone.",195,cns-safety-manual.pdf,33,Specific Chemical Hazard Information,Specific Chemical Hazard Information,fine_grained
158,"Systemic damage can occur when fluorine becomes distributed throughout the body.  These conditions include POTENTIALLY FATAL electrolyte imbalances such as hypocalcemia (too little calcium) and hyperkalemia (too much potassium).  Since calcium and potassium regulate the heartbeat, irregular beating and cardiac arrest are manifestations.",338,cns-safety-manual.pdf,33,Specific Chemical Hazard Information,Specific Chemical Hazard Information,fine_grained
159,"o Deaths have been reported from concentrated acid burns to as little as 2.5% BSA [body surface area exposed to HF]. For reference, this is equivalent to the area of the FRONT AND BACK OF ONE HAND.",197,cns-safety-manual.pdf,33,Specific Chemical Hazard Information,Specific Chemical Hazard Information,fine_grained
160,"Calcium gluconate is used as an antidote. This provides extra calcium ions which can scavenge free fluorine ions before they penetrate and damage tissue. In cases of skin contact, calcium gluconate gel must be applied immediately to the area of contact.",253,cns-safety-manual.pdf,33,Specific Chemical Hazard Information,Specific Chemical Hazard Information,fine_grained
161,"Pure hydrogen fluoride is an extremely toxic gas which very easily dissolves in water. ""Hydrofluoric acid"" describes this solution form. HF easily passes between gas and liquid phases; so, HF- (and NH4F-) containing solutions will emit toxic fumes.  Although CNS lab safety precautions tend to emphasize protection against skin contact with fluoride-containing solutions, remember to avoid inhalation of the fumes by always working under fully exhausted areas of the wet benches.  And DON'T put your HEAD inside the bench.",522,cns-safety-manual.pdf,34,Specific Chemical Hazard Information,Specific Chemical Hazard Information,fine_grained
162,Do not use glass containers to store HF in. Use only plastic containers. HF etches glass.,89,cns-safety-manual.pdf,34,Specific Chemical Hazard Information,Specific Chemical Hazard Information,fine_grained
163,N-Methylpyrrolidone (NMP) : Combustible liquid. Can be readily absorbed through the skin. Can cause severe eye irritation. Repeated or prolonged contact can cause skin irritation. Strong solvent odor. Use two pairs of nitrile gloves when handling. NMP is listed as a reproductive toxin under Proposition 65. NMP has been identified by the State of California to cause birth defects or other reproductive harm. Remover PG 1165 and Baker PRS 3000 and AZ 400T Photoresist Developer contain this chemical.,501,cns-safety-manual.pdf,34,Specific Chemical Hazard Information,Specific Chemical Hazard Information,fine_grained
164,"∞ Silane Gas can ignite spontaneously upon contact with air. It can accumulate in certain areas and then explode. The gas is very unpredictable, and it is stored and distributed to the cleanroom from the LISE loading dock gas storage room M14.
∞ Piranha Etch: Is a common name applied to a mixture of Hydrogen Peroxide and Sulfuric (typically 1:5). Piranha is extremely aggressive toward organic materials such as flesh and photoresist residue. It also removes heavy metal contamination. It is difficult to dispose of this mixture as the waste continues to react and decompose for an extended period of time. This continuing reaction can build up pressure in closed containers, eventually causing them to burst. Also, if the solution is mixed very peroxide rich, unstable compounds may be formed. Therefore, Piranha is not allowed to be stored in closed containers. Nanostrip is a commercial stabilized version of Piranha Etch and is a recommended substitute.",959,cns-safety-manual.pdf,34,Specific Chemical Hazard Information,Specific Chemical Hazard Information,fine_grained
165,Pregnancy: Users who believe themselves to be pregnant should discuss laboratory use with the Safety Officer as soon as possible. This need not severely restrict laboratory use but should nonetheless be discussed.,213,cns-safety-manual.pdf,34,Specific Chemical Hazard Information,Specific Chemical Hazard Information,fine_grained
166,Environmental Perspective,25,cns-safety-manual.pdf,35,Hazardous Waste Management,Hazardous Waste Management,fine_grained
167,Work to minimize unnecessary release of chemicals into the environment,70,cns-safety-manual.pdf,35,Hazardous Waste Management,Hazardous Waste Management,fine_grained
168,Use sparingly - only as much as you need,40,cns-safety-manual.pdf,35,Hazardous Waste Management,Hazardous Waste Management,fine_grained
169,Solvents!,9,cns-safety-manual.pdf,35,Hazardous Waste Management,Hazardous Waste Management,fine_grained
170,Photoresist!,12,cns-safety-manual.pdf,35,Hazardous Waste Management,Hazardous Waste Management,fine_grained
171,Keep covered except when in use to avoid excess evaporation,59,cns-safety-manual.pdf,35,Hazardous Waste Management,Hazardous Waste Management,fine_grained
172,Reference the chemical restriction signs on each wet bench.,59,cns-safety-manual.pdf,35,Hazardous Waste Management,Hazardous Waste Management,fine_grained
173,Solvent Wet Benches contain a five-gallon stainless steel metal container in the cabinet below. The metal containers are directly under each cup sink. Only solvents can be used in these stainless-steel wet benches and only solvents can be poured down these cup sinks into the metal waste containers.,299,cns-safety-manual.pdf,35,Hazardous Waste Management,Hazardous Waste Management,fine_grained
174,"Halogenated solvents like Trichloroethylene, Methylene Chloride or bromobenzene cannot be poured down any cup sink but must be collected separately in a one-gallon waste container and labeled with a hazardous waste label.",221,cns-safety-manual.pdf,35,Hazardous Waste Management,Hazardous Waste Management,fine_grained
175,Spinner Wet Benches are used for photoresist liquids only and only photoresist chemical can be poured down the cup sink in the spinner hoods.,141,cns-safety-manual.pdf,35,Hazardous Waste Management,Hazardous Waste Management,fine_grained
176,"Dedicated Developer hoods using chemicals such as CD30 and CD26, AZ MIF 726 Developer, AZ MIF 400 Developer have aspirators on the bench. Aspirators are not to be used for regular disposal operations.  They will only be used for large built-in chemical baths, which are covered in RCA clean training. Basic solutions will be disposed of in accordance with the latest revision of SOP019'Wet Bench Safety'. BTS 220 and SU8 Developers must be disposed of in solvent benches. Disposal of basic solutions like developers must be disposed of in accordance with SOP019 'Wet Bench Safety'.",581,cns-safety-manual.pdf,35,Hazardous Waste Management,Hazardous Waste Management,fine_grained
177,Acid Wet Benches are used for etching and handling caustic liquids. Refer to the chemical restriction chart on the outside of the wet bench. The acid solutions once spent will be disposed of in accordance with the latest revision of SOP019 Wet Bench Safety.,257,cns-safety-manual.pdf,35,Hazardous Waste Management,Hazardous Waste Management,fine_grained
178,Figure 2:  Waste storage.,25,cns-safety-manual.pdf,36,See picture below for appropriate label and storage:,See picture below for appropriate label and storage:,fine_grained
179,Figure 3: Waste label.,22,cns-safety-manual.pdf,36,See picture below for appropriate label and storage:,See picture below for appropriate label and storage:,fine_grained
180,Gallium Arsenide wafers must be disposed of in a separate container - a white five-gallon container marked with the words 'Gallium Arsenide Wafer Waste Only'.,158,cns-safety-manual.pdf,36,See picture below for appropriate label and storage:,See picture below for appropriate label and storage:,fine_grained
181,Broken Glass and Silicon wafers must be disposed of in a similar white five-gallon container and it is marked with appropriate signage. This waste stream is not considered hazardous.,182,cns-safety-manual.pdf,36,See picture below for appropriate label and storage:,See picture below for appropriate label and storage:,fine_grained
182,"Razors, scalpels and syringes must be disposed of in black sharps containers",76,cns-safety-manual.pdf,36,See picture below for appropriate label and storage:,See picture below for appropriate label and storage:,fine_grained
183,"Syringes, needles, and other sharps used in bio room G05 must be disposed of in RED sharps containers.",102,cns-safety-manual.pdf,36,See picture below for appropriate label and storage:,See picture below for appropriate label and storage:,fine_grained
184,"The release of hazardous materials to the environment (air, groundwater, loading dock drains, soil) shall be reported immediately to 5-5560 . Operations Center will notify the CNS Emergency Response Team (ERT) and the Harvard EHS emergency on-call person who will try to stop and contain the release.",300,cns-safety-manual.pdf,36,Chemical Spill,Chemical Spill,fine_grained
185,"-Evacuate spill area and prevent others from entering.
-Contact any CNS staff and call 5-5560.
-Utilize the A-frame 'Chemical Spill Keep Away' signs. They are located near spill supplies.
-Remain clear of spill area but stand by to warn others of potential hazards until CNS Emergency Response Team members arrive.
-If directed to evacuate by CNS staff or EHS, proceed directly to the gown room by normal fab routes and stand by for further instructions.
-If the normal route to the gown room is blocked, exit fab through nearest exit, and meet just outside the gowning area.
-Be prepared to provide helpful information to emergency responders, including knowledge of injuries, missing persons, nature of spilled chemical, and activities leading up to the spill.",762,cns-safety-manual.pdf,37,Procedure for spills OUTSIDE of a Wet Bench or any vented enclosure:,Procedure for spills OUTSIDE of a Wet Bench or any vented enclosure:,fine_grained
186,Small (incidental) spills and drips at workstations can be cleaned up by users wearing the appropriate personal protective equipment.,133,cns-safety-manual.pdf,37,Procedure for spills INSIDE a wet bench or fume hood or any other type of vented enclosure:,Procedure for spills INSIDE a wet bench or fume hood or any other type of vented enclosure:,fine_grained
187,"1. Exception: Never pick up a Hydrofluoric acid spill unless it is a dilute solution (<5%) and less than 50 ml. Otherwise call CNS staff and 5-5560.
2. If at any time a CNS user is uncomfortable or uncertain regarding the spill cleanup, call 5-5560 first and then try to contact CNS staff.
3. All Non-incidental spills CALL 5-5560 to activate CNS/EHS ERT for spill response.
4. Spill kits are available in most labs.  In the cleanroom these kits can be found in yellow 5-gallon containers labeled 'Spill Kits'. The kits will be in the main corridor of the cleanroom and in each wet lab. There will be an Acid spill kit, a Base spill kit, and general wipes for solvent spills.
5. Make sure waste is disposed of in a solid container and labeled as hazardous waste.",762,cns-safety-manual.pdf,"37, 38",Procedure for spills INSIDE a wet bench or fume hood or any other type of vented enclosure:,Procedure for spills INSIDE a wet bench or fume hood or any other type of vented enclosure:,fine_grained
188,Figure 4: Contents of chemical spill kit.,41,cns-safety-manual.pdf,38,Procedure for spills INSIDE a wet bench or fume hood or any other type of vented enclosure:,Procedure for spills INSIDE a wet bench or fume hood or any other type of vented enclosure:,fine_grained
189,"Any solid nanoparticle waste must be collected in waste receptacles labeled as 'Contains nano-waste.' Not all nano-waste is designated as hazardous waste. If the nano-waste contains a listed hazardous waste material as a component in it, then it will be designated as hazardous waste. Contact the CNS staff in charge of the area to determine if nano-waste is a hazardous waste. Nano particles in solvents will be treated as liquid hazardous waste. Gloves and wipes contaminated with any nano-waste material will be disposed of in containers labeled with the words 'Contains nano-waste.' Do not dispose of any nanowaste into the regular trash. If not sure what to do with nano-waste, ask CNS staff.",697,cns-safety-manual.pdf,38,Nanoparticle Waste:,Nanoparticle Waste:,fine_grained
190,"1. Immediately use eye wash / safety shower station to flush affected area with water for a minimum of 15 minutes.
2. Remove contaminated clothing while flushing with water.
3. Notify CNS staff and/or have someone call 5-5560 and obtain medical attention.",255,cns-safety-manual.pdf,38,Chemical Exposure First Aid and Response,Chemical Exposure First Aid and Response,fine_grained
191,"1. Immediately rinse the affected skin with water
2. Remove all jewelry and clothing exposed to HF while rinsing in emergency shower for 5 minutes
3. Someone must call 911 and/or Operations Center at (5)-5560. MSDS for HF must be taken with a person.
4. Apply Calgonate (calcium gluconate) to affected area using a clean chemical resistant glove.
5. Take Calgonate Gel with you and apply on the way to the emergency room.",421,cns-safety-manual.pdf,"38, 39",If suspected or confirmed Hydrofluoric Acid exposure:,If suspected or confirmed Hydrofluoric Acid exposure:,fine_grained
192,1. Ensure injured person has flushed exposed area and removed contaminated clothing.,84,cns-safety-manual.pdf,39,CNS and EHS ERT staff must do the following:,CNS and EHS ERT staff must do the following:,fine_grained
193,"§ Eye contact with any chemical.
§ Skin contact with hydrofluoric acid (HF, BOE).
§ Skin contact results in redness, pain, or blisters.",135,cns-safety-manual.pdf,39,Assist individual in obtaining medical attention. Medical attention is necessary in the following situations:,Assist individual in obtaining medical attention. Medical attention is necessary in the following situations:,fine_grained
194,Obtain Material Safety Data Sheet(s) of the chemical contacted.,63,cns-safety-manual.pdf,39,Assist individual in obtaining medical attention. Medical attention is necessary in the following situations:,Assist individual in obtaining medical attention. Medical attention is necessary in the following situations:,fine_grained
195,"§ NFPA stands for National Fire Protection Association.
§ The NFPA 'fire diamond' (Fig. 6) is a visual notification standard maintained by the US Fire Protection Association.
§ This diamond allows emergency and lab personnel to easily identify the hazards of a particular chemical or storage area.",297,cns-safety-manual.pdf,39,How to Read an NFPA Hazard Communication Diamond,How to Read an NFPA Hazard Communication Diamond,fine_grained
196,Figure 5: NFPA diamond.,23,cns-safety-manual.pdf,40,How to Read an NFPA Hazard Communication Diamond,How to Read an NFPA Hazard Communication Diamond,fine_grained
197,Each quadrant of the diamond indicates a particular hazard.  All users of CNS laboratories must be able to interpret these hazard indicators.,141,cns-safety-manual.pdf,40,How to Read an NFPA Hazard Communication Diamond,How to Read an NFPA Hazard Communication Diamond,fine_grained
198,"GLYPH<0> 4= Deadly
GLYPH<0> 3= Extreme Danger
GLYPH<0> 2=Hazardous
GLYPH<0> 1= Slightly Hazardous
0= Normal Material",116,cns-safety-manual.pdf,40,§ Blue Quadrant (Health),§ Blue Quadrant (Health),fine_grained
199,"GLYPH<0> 4=Below 73°F
GLYPH<0> 3=Below 100°F
GLYPH<0> 2=Below 100°F - not exceeding 200°F
GLYPH<0> 1=Above 200°F
GLYPH<0> 0= Will not Burn",138,cns-safety-manual.pdf,40,§ Red Quadrant (Flammability -Flash Points),§ Red Quadrant (Flammability -Flash Points),fine_grained
200,"§ Yellow Quadrant (Reactivity)
GLYPH<0> 4= May Detonate
GLYPH<0> 3= Shock and Heat May Detonate
GLYPH<0> 2= Violent Chemical Change
GLYPH<0> 1 = Unstable if Heated
GLYPH<0> 0=Stable
§ White Quadrant (Specific Hazard)
GLYPH<0> OX = Oxidizer
GLYPH<0> W = Use no Water",265,cns-safety-manual.pdf,41,§ Red Quadrant (Flammability -Flash Points),§ Red Quadrant (Flammability -Flash Points),fine_grained
201,ACID = Acid,11,cns-safety-manual.pdf,41,§ Red Quadrant (Flammability -Flash Points),§ Red Quadrant (Flammability -Flash Points),fine_grained
202,"GLYPH<0> ALK = Alkali
GLYPH<0> COR = Corrosive",46,cns-safety-manual.pdf,41,§ Red Quadrant (Flammability -Flash Points),§ Red Quadrant (Flammability -Flash Points),fine_grained
203,GLYPH<0>,8,cns-safety-manual.pdf,41,§ Red Quadrant (Flammability -Flash Points),§ Red Quadrant (Flammability -Flash Points),fine_grained
